{
  "schema_version": 1,
  "id": "glm5.3-cold-20260909",
  "title": "GLM-5.3 - Prefill and Decode Capacity",
  "description": "Measured Prefill and Decode capacity for GLM-5.3 on Dell PowerEdge XE7740 with 8 NVIDIA RTX PRO 6000 Blackwell Server Edition 96 GB GPUs.",
  "keywords": [
    "Dell PowerEdge XE7740",
    "GLM-5.3",
    "RadixArk/GLM-5.3-NVFP4",
    "LLM inference benchmark",
    "GPU server benchmark",
    "Prefill throughput",
    "Decode throughput"
  ],
  "hardware": {
    "model": "Dell PowerEdge XE7740",
    "host": "xe7740-04",
    "gpu_count": 8,
    "gpu_model": "NVIDIA RTX PRO 6000 Blackwell Server Edition 96 GB",
    "aggregate_vram_gib": 768.0
  },
  "model": {
    "name": "GLM-5.3",
    "repository": "RadixArk/GLM-5.3-NVFP4",
    "revision": "363e8f086905afd83db356a620f9aa401c23800a",
    "quantization": "ModelOpt NVFP4 W4A4 routed experts in layers 3-77; BF16 MTP layer 78"
  },
  "report": {
    "kind": "capacity-report",
    "date": "2026-09-09",
    "subtitle": "RadixArk GLM-5.3 on one eight-GPU TP8 replica, global concurrency 1 to 192",
    "path": "results/xe7740-8x-rtx6000/glm5.3/cold-20260909/xe7740--glm5.3--cold-capacity-report.html"
  },
  "deployment": {
    "summary": "one TP8 replica across eight GPUs, no load balancer",
    "request_path": "AIPerf → HAProxy → model server replicas",
    "replicas": 1,
    "tensor_parallel_per_replica": 8,
    "active_sequence_ceiling": 128,
    "kv_cache_dtype": "fp8",
    "speculative_decoding": "MTP-3",
    "max_model_len": 262144,
    "max_num_seqs_per_replica": 128,
    "max_num_batched_tokens_per_replica": 8192,
    "cpu_numa_affinity": "not explicitly pinned for this TP8 deployment"
  },
  "source": {
    "campaign_path": "results/xe7740-8x-rtx6000/glm5.3/5-campaign/20260909-glm53-cold",
    "normalized_data_path": "results/xe7740-8x-rtx6000/glm5.3/cold-20260909/normalized-report-data.json"
  },
  "evidence": {
    "runs": 72,
    "requests": 10422.0,
    "errors": 0,
    "repetitions": 3,
    "classification": "repeated benchmark evidence"
  },
  "axis": {
    "measured_concurrency": [
      1,
      8,
      32,
      64,
      96,
      128,
      160,
      192
    ],
    "major_ticks": [
      1,
      8,
      32,
      64,
      96,
      128,
      160,
      192
    ],
    "maximum": 192
  },
  "headlines": {
    "decode": {
      "value": 1233.8794115928304,
      "unit": "output tokens/s",
      "concurrency": 128,
      "statistic": "median"
    },
    "prefill": {
      "value": 6238.175223242521,
      "unit": "input tokens/s",
      "concurrency": 160,
      "statistic": "median"
    }
  },
  "normalized_data": {
    "schema_version": 1,
    "source_campaign": "results/xe7740-8x-rtx6000/glm5.3/5-campaign/20260909-glm53-cold",
    "generated_at": "2026-09-09T20:25:30.046032+00:00",
    "source_counts": {
      "runs": 72,
      "requests": 10422.0,
      "errors": 0,
      "excluded_runs": 0
    },
    "selection": {
      "policy": "maximum-median-useful-tps",
      "decode_source_id": "decode",
      "prefill_source_id": "prefill"
    },
    "idle_baseline": {
      "aggregate_gpu_board_power_w": null,
      "source": "results/xe7740-8x-rtx6000/glm5.3/5-campaign/20260909-glm53-cold/idle"
    },
    "series": {
      "decode": {
        "source_id": "decode",
        "points": [
          {
            "concurrency": 1,
            "throughput": {
              "median": 82.15882939473295,
              "minimum": 80.25155002529164,
              "maximum": 82.31182863725773,
              "mean": 81.57406935242744,
              "standard_deviation": 1.1478872854244413,
              "n": 3,
              "unit": "output tokens/s"
            },
            "per_user_throughput": {
              "median": 88.4650909856305,
              "minimum": 85.81587933828914,
              "maximum": 88.46545025160542,
              "mean": 87.58214019184169,
              "standard_deviation": 1.5296267794341665,
              "n": 3,
              "unit": "output tokens/s/user"
            },
            "ttft_p50": {
              "median": 608.9835489999999,
              "minimum": 595.440106,
              "maximum": 613.649516,
              "mean": 606.0243903333334,
              "standard_deviation": 9.45849449690095,
              "n": 3,
              "unit": "ms"
            },
            "ttft_p95": {
              "median": 622.379733,
              "minimum": 612.3737133,
              "maximum": 675.6661630999998,
              "mean": 636.8065364666667,
              "standard_deviation": 34.02327209603368,
              "n": 3,
              "unit": "ms"
            },
            "itl_average": {
              "median": 11.357255562860866,
              "minimum": 11.356808358539764,
              "maximum": 11.683194273235237,
              "mean": 11.465752731545289,
              "standard_deviation": 0.18831003169587737,
              "n": 3,
              "unit": "ms"
            },
            "itl_p95": {
              "median": 12.193316577183833,
              "minimum": 12.110685219817471,
              "maximum": 12.580784641981744,
              "mean": 12.29492881299435,
              "standard_deviation": 0.2509823729459995,
              "n": 3,
              "unit": "ms"
            },
            "gpu_board_power": null,
            "joules_per_token": null,
            "host_cpu_busy": null,
            "cpu_user": null,
            "cpu_system": null,
            "cpu_iowait": null,
            "host_load1": null,
            "host_ram_used": null,
            "host_ram_available": null,
            "swap_used": null,
            "gpu_utilization": null,
            "gpu_memory_copy": null,
            "gpu_temperature": null,
            "gpu_sm_clock": null,
            "gpu_memory_clock": null,
            "gpu_vram_used": null,
            "running_requests": {
              "median": 0.9656862745098039,
              "minimum": 0.96,
              "maximum": 0.9698492462311558,
              "mean": 0.9651785069136531,
              "standard_deviation": 0.004944217205914366,
              "n": 3,
              "unit": "requests"
            },
            "waiting_requests": {
              "median": 0.0,
              "minimum": 0.0,
              "maximum": 0.0,
              "mean": 0.0,
              "standard_deviation": 0.0,
              "n": 3,
              "unit": "requests"
            },
            "kv_cache_usage": {
              "median": 0.07717268015334004,
              "minimum": 0.07627532340737098,
              "maximum": 0.07727188542173864,
              "mean": 0.07690662966081656,
              "standard_deviation": 0.0005489727776029777,
              "n": 3,
              "unit": "%"
            },
            "mamba_usage": null,
            "speculative_acceptance": {
              "median": 56.71691792294807,
              "minimum": 54.189035301773224,
              "maximum": 56.91015952980689,
              "mean": 55.93870425150939,
              "standard_deviation": 1.5183351589515741,
              "n": 3,
              "unit": "%"
            },
            "preemptions": {
              "median": 0.0,
              "minimum": 0.0,
              "maximum": 0.0,
              "mean": 0.0,
              "standard_deviation": 0.0,
              "n": 3,
              "unit": "preemptions/s"
            },
            "server_prompt_rate": {
              "median": 2.028199146101434,
              "minimum": 1.9824471029839261,
              "maximum": 2.033905333591818,
              "mean": 2.014850527559059,
              "standard_deviation": 0.028206853547783652,
              "n": 3,
              "unit": "input tokens/s"
            },
            "server_decode_rate": {
              "median": 77.88284721029505,
              "minimum": 76.12596875458276,
              "maximum": 78.10196480992582,
              "mean": 77.37026025826788,
              "standard_deviation": 1.0831431762348953,
              "n": 3,
              "unit": "output tokens/s"
            },
            "container_cpu": null,
            "container_memory": null,
            "container_tx": null,
            "disk_write": null,
            "process_rss": null,
            "process_pss": null,
            "process_private": null,
            "process_shared": null,
            "process_swap": null,
            "haproxy_frontend_ingress": null,
            "haproxy_frontend_egress": null,
            "haproxy_backend_ingress": null,
            "haproxy_backend_egress": null,
            "haproxy_frontend_ingress_total": null,
            "haproxy_frontend_egress_total": null,
            "haproxy_backend_ingress_total": null,
            "haproxy_backend_egress_total": null,
            "haproxy_ingress_per_request": null,
            "haproxy_egress_per_request": null,
            "haproxy_queue": null,
            "haproxy_retries": null,
            "haproxy_errors": null,
            "haproxy_backend_imbalance": null,
            "pcie_rx": null,
            "pcie_tx": null,
            "pcie_replay_delta": null,
            "e2e_p50": {
              "median": 9602.792518999999,
              "minimum": 9194.341003,
              "maximum": 9611.065843,
              "mean": 9469.399788333334,
              "standard_deviation": 238.24381107237352,
              "n": 3,
              "unit": "ms"
            },
            "e2e_p95": {
              "median": 9947.6699803,
              "minimum": 9896.6825423,
              "maximum": 10321.265778099998,
              "mean": 10055.206100233332,
              "standard_deviation": 231.8204991978416,
              "n": 3,
              "unit": "ms"
            }
          },
          {
            "concurrency": 8,
            "throughput": {
              "median": 351.37740474171403,
              "minimum": 342.248550354223,
              "maximum": 366.09241819300297,